{
  "audio_duration_sec": 5402.784,
  "batch_size": 1,
  "cer": null,
  "cost_per_audio_hour": null,
  "dataset_manifest_id": "benchmark-v1",
  "dataset_manifest_sha256": "9c47976f6101ebca1fc2575d46fde80d9a33dbc14b1e1f6dc2ca9aeb57a87694",
  "dataset_revision": "bf8819e8d9a5feb51b0c718686bd20ea67a3c729",
  "decoder": "tdt",
  "fixture_repo_id": "gawohok7/rtf-benchmark-fixtures",
  "fixture_revision": "0c3ef94b38c45689764b359493ded25b7fbc2713",
  "gpu": "t4",
  "gpu_price_per_hour": null,
  "gpu_utilization_percent": null,
  "image_digest": "sha256:b70227a8fe187a92c8fa1cdb7c3d4c2d751d7fd159356ada9b93148328ade06f",
  "metrics_sha256": "6ae8485dfcfa770f6c0ae66902357a9ee916771a87177201dfc2e5422fe361d7",
  "metrics_uri": "https://huggingface.co/datasets/gawohok7/rtf-benchmark-fixtures/resolve/a637b74fe6e11e16c93e0ef68d7ff8c6138cc276/results/rtf-hf-32399367362-b1/metrics.json",
  "model_id": "nvidia/parakeet-tdt_ctc-0.6b-ja",
  "peak_vram_mb": 5250.89111328125,
  "phase": "phase1",
  "precision": "float16",
  "processing_duration_sec": 55.99499431933335,
  "provider_execution_proof": true,
  "repeat": 3,
  "rtf": 0.010364100123072355,
  "rtf_scope": "model",
  "rtfx": 96.48691040467853,
  "run_id": "rtf-hf-32399367362-b1",
  "schema_version": 1,
  "service_id": "hf-jobs",
  "status": "completed",
  "wer": null
}
