{
  "audio_duration_sec": 5402.784,
  "batch_size": 32,
  "cer": 0.5552377547372185,
  "cost_per_audio_hour": null,
  "dataset_manifest_id": "benchmark-v1",
  "dataset_manifest_sha256": "0b4db78f1f110c898b5857628a51493cad77ab90af778e8ba61bd42128651522",
  "dataset_revision": "bf8819e8d9a5feb51b0c718686bd20ea67a3c729",
  "decoder": "tdt",
  "fixture_repo_id": "gawohok7/rtf-benchmark-fixtures",
  "fixture_revision": "16ab182788b1c97c23327aba50692edebd02b2f7",
  "gpu": "l4",
  "gpu_price_per_hour": null,
  "gpu_utilization_percent": 96.86153846153846,
  "image_digest": "sha256:299b7e45b1245ccf5b33a8f2e173ab413b41077b20c8be74d60f338f60589f7e",
  "metrics_sha256": "13372ff46f0a2db555c7e2243f68ce54a6693785e3861a2af0bc73d4100afe90",
  "metrics_uri": "https://huggingface.co/datasets/gawohok7/rtf-benchmark-fixtures/resolve/d40230d64061256a0d161c8a57b7ab8ce164623d/results/rtf-hf-32666036040-b32/metrics.json",
  "model_id": "nvidia/parakeet-tdt_ctc-0.6b-ja",
  "peak_vram_mb": 5395.25634765625,
  "phase": "phase1",
  "precision": "float16",
  "processing_duration_sec": 34.17046731449989,
  "provider_execution_proof": true,
  "repeat": 32,
  "rtf": 0.00632460363296032,
  "rtf_scope": "model",
  "rtfx": 158.11267520205624,
  "run_id": "rtf-hf-32666036040-b32",
  "schema_version": 1,
  "service_id": "hf-jobs",
  "status": "completed",
  "wer": null
}
