{
  "audio_duration_sec": 5402.784,
  "batch_size": 1,
  "cer": null,
  "cost_per_audio_hour": null,
  "dataset_manifest_id": "benchmark-v1",
  "dataset_manifest_sha256": "9c47976f6101ebca1fc2575d46fde80d9a33dbc14b1e1f6dc2ca9aeb57a87694",
  "dataset_revision": "bf8819e8d9a5feb51b0c718686bd20ea67a3c729",
  "decoder": "tdt",
  "fixture_repo_id": "gawohok7/rtf-benchmark-fixtures",
  "fixture_revision": "644f9fefb84340b2a0007d9a42da76f60432c826",
  "gpu": "l4",
  "gpu_price_per_hour": null,
  "gpu_utilization_percent": null,
  "image_digest": "sha256:b70227a8fe187a92c8fa1cdb7c3d4c2d751d7fd159356ada9b93148328ade06f",
  "metrics_sha256": "33f8dd301cb834961a618e33be30b04875dd09a6438d9240f980c0dfc727f2e5",
  "metrics_uri": "https://huggingface.co/datasets/gawohok7/rtf-benchmark-fixtures/resolve/8d2c866ee315bdbed468b2e92e4587d85b6a5cc8/results/rtf-hf-32401077937-b1/metrics.json",
  "model_id": "nvidia/parakeet-tdt_ctc-0.6b-ja",
  "peak_vram_mb": 5250.89111328125,
  "phase": "phase1",
  "precision": "float16",
  "processing_duration_sec": 33.55422414166666,
  "provider_execution_proof": true,
  "repeat": 3,
  "rtf": 0.0062105433313022805,
  "rtf_scope": "model",
  "rtfx": 161.01650800177435,
  "run_id": "rtf-hf-32401077937-b1",
  "schema_version": 1,
  "service_id": "hf-jobs",
  "status": "completed",
  "wer": null
}
