{
  "audio_duration_sec": 5402.784,
  "batch_size": 1,
  "cer": null,
  "cost_per_audio_hour": null,
  "dataset_manifest_id": "benchmark-v1",
  "dataset_manifest_sha256": "9c47976f6101ebca1fc2575d46fde80d9a33dbc14b1e1f6dc2ca9aeb57a87694",
  "dataset_revision": "bf8819e8d9a5feb51b0c718686bd20ea67a3c729",
  "decoder": "tdt",
  "fixture_repo_id": "gawohok7/rtf-benchmark-fixtures",
  "fixture_revision": "eb938860880292913212125844b851cef02211ac",
  "gpu": "rtx3090",
  "gpu_price_per_hour": null,
  "gpu_utilization_percent": null,
  "image_digest": "sha256:67fae6c12ef6abb406b200984f81186da5a622a75b13ec476175193616d0b70c",
  "metrics_sha256": "02954d2594b807a5a16320a189b8f6be9e565506facf03fb79f0f3fe93b9de0f",
  "metrics_uri": "https://huggingface.co/datasets/gawohok7/rtf-benchmark-fixtures/resolve/d4c46bb6d59c4627c66adbdb9d905466e5f64519/results/rtf-runpod-32629746571-b1/metrics.json",
  "model_id": "nvidia/parakeet-tdt_ctc-0.6b-ja",
  "peak_vram_mb": 5346.50390625,
  "phase": "phase1",
  "precision": "float16",
  "processing_duration_sec": 15.671496693976223,
  "provider_execution_proof": true,
  "repeat": 3,
  "rtf": 0.002900633579646387,
  "rtf_scope": "model",
  "rtfx": 344.75226620037574,
  "run_id": "rtf-runpod-32629746571-b1",
  "schema_version": 1,
  "service_id": "runpod-pod",
  "status": "completed",
  "wer": null
}
