{
  "audio_duration_sec": 5402.784,
  "batch_size": 1,
  "cer": 0.5559925316807691,
  "cost_per_audio_hour": null,
  "dataset_manifest_id": "benchmark-v1",
  "dataset_manifest_sha256": "0b4db78f1f110c898b5857628a51493cad77ab90af778e8ba61bd42128651522",
  "dataset_revision": "bf8819e8d9a5feb51b0c718686bd20ea67a3c729",
  "decoder": "tdt",
  "fixture_repo_id": "gawohok7/rtf-benchmark-fixtures",
  "fixture_revision": "cdcd04b474a64bb40f8de8a2f01296ed7dbf1954",
  "gpu": "t4",
  "gpu_price_per_hour": null,
  "gpu_utilization_percent": 97.62739268320308,
  "image_digest": "sha256:f0b9dbbf4a9ebd83af1eafa7c311d5e2facc0fa2b2d03b8554b751667647f487",
  "metrics_sha256": "e1b8e4a9bd669f9fea00883514b7863c6dfce0b8d5566e3228f2a000d36fe7fb",
  "metrics_uri": "https://huggingface.co/datasets/gawohok7/rtf-benchmark-fixtures/resolve/5ff1c55a77979cb20dab2391665a83a4d701d6da/results/rtf-hf-32635100295-b1/metrics.json",
  "model_id": "nvidia/parakeet-tdt_ctc-0.6b-ja",
  "peak_vram_mb": 5346.50390625,
  "phase": "phase1",
  "precision": "float16",
  "processing_duration_sec": 56.56696427566669,
  "provider_execution_proof": true,
  "repeat": 3,
  "rtf": 0.01046996590566395,
  "rtf_scope": "model",
  "rtfx": 95.5112947845445,
  "run_id": "rtf-hf-32635100295-b1",
  "schema_version": 1,
  "service_id": "hf-jobs",
  "status": "completed",
  "wer": null
}
