{
  "audio_duration_sec": 5402.784,
  "batch_size": 8,
  "cer": 0.5559925316807691,
  "cost_per_audio_hour": 0.05330851649816095,
  "dataset_manifest_id": "benchmark-v1",
  "dataset_manifest_sha256": "0b4db78f1f110c898b5857628a51493cad77ab90af778e8ba61bd42128651522",
  "dataset_revision": "bf8819e8d9a5feb51b0c718686bd20ea67a3c729",
  "decoder": "tdt",
  "fixture_repo_id": "gawohok7/rtf-benchmark-fixtures",
  "fixture_revision": "d40230d64061256a0d161c8a57b7ab8ce164623d",
  "gpu": "t4",
  "gpu_price_per_hour": 0.40002,
  "gpu_utilization_percent": 94.7439838534389,
  "image_digest": "sha256:6b9e5f17d6e8d2e9091cc7c2f439e4e91e61f33581b556530cc39768717f80d4",
  "metrics_sha256": "fa5c68e64e3633d3e7efa2c627485233f12ac338044aab9893993235b5b64fdd",
  "metrics_uri": "https://huggingface.co/datasets/gawohok7/rtf-benchmark-fixtures/resolve/37c2f19d7d02224694c758ff1d0d46edf20c71ad/results/rtf-hf-32671888007-b8/metrics.json",
  "model_id": "nvidia/parakeet-tdt_ctc-0.6b-ja",
  "peak_vram_mb": 5395.255126953125,
  "phase": "phase1",
  "precision": "float16",
  "processing_duration_sec": 59.45099974899989,
  "provider_execution_proof": true,
  "repeat": 8,
  "rtf": 0.011003771342515246,
  "rtf_scope": "model",
  "rtfx": 90.87793347143649,
  "run_id": "rtf-hf-32671888007-b8",
  "schema_version": 1,
  "service_id": "hf-jobs",
  "status": "completed",
  "wer": null
}
