{
  "audio_duration_sec": 5402.784,
  "batch_size": 8,
  "cer": 0.5552377547372185,
  "cost_per_audio_hour": 0.062188604985873946,
  "dataset_manifest_id": "benchmark-v1",
  "dataset_manifest_sha256": "0b4db78f1f110c898b5857628a51493cad77ab90af778e8ba61bd42128651522",
  "dataset_revision": "bf8819e8d9a5feb51b0c718686bd20ea67a3c729",
  "decoder": "tdt",
  "fixture_repo_id": "gawohok7/rtf-benchmark-fixtures",
  "fixture_revision": "cfe790fffbbabb54f462d75827569cf59c270a32",
  "gpu": "l4",
  "gpu_price_per_hour": 0.7999799999999999,
  "gpu_utilization_percent": 93.85696517412936,
  "image_digest": "sha256:8a5ac5c94274162fc64fd6064c7dbb28666e46ad0d37f23dfdd2caa876b900fe",
  "metrics_sha256": "570206b304efd300a7a8a1597edf6a21a63bde2874e5986f236ee05404aee994",
  "metrics_uri": "https://huggingface.co/datasets/gawohok7/rtf-benchmark-fixtures/resolve/812515512ed1355c729da31a30d0e96c546724db/results/rtf-hf-32676875138-b8/metrics.json",
  "model_id": "nvidia/parakeet-tdt_ctc-0.6b-ja",
  "peak_vram_mb": 5395.255126953125,
  "phase": "phase1",
  "precision": "float16",
  "processing_duration_sec": 34.53885618700002,
  "provider_execution_proof": true,
  "repeat": 8,
  "rtf": 0.0063927886413745255,
  "rtf_scope": "model",
  "rtfx": 156.42625716231848,
  "run_id": "rtf-hf-32676875138-b8",
  "schema_version": 1,
  "service_id": "hf-jobs",
  "status": "completed",
  "wer": null
}
